<?xml version="1.0" encoding="UTF-8"?>
<spells xmlns="stendhal" xmlns:xsi="http://www.w3.org/2001/XMLSchema-instance"
	xsi:schemaLocation="stendhal ../spells.xsd ">
	<spell name="healtest">
		<implementation class-name="games.stendhal.server.entity.spell.HealingSpell" />
		<nature value="light"/>
		<attributes>
			<mana value="5" />
			<cooldown value="3" />
			<minimum-level value="10" />
			<range value="10" />
			<atk value="0" />
			<def value="0" />
			<amount value="100" />
			<regen  value="100" />
			<rate  value="1" />
			<lifesteal value="0.5" />
		</attributes>
	</spell>
</spells>
